[{"t":"Vicious (Villains, #1)","a":"V.E. Schwab","r":2,"g":"40874032","c":"1670752670l/40874032._SY475_.jpg","n":402,"w":"6846576427","d":"2026/09/30"},{"t":"The Birds","a":"Daphne du Maurier","r":5,"v":1,"i":"3150092876","g":"1030934","c":"1438631203l/1030934.jpg","n":75,"w":"3652211999","d":"2026/09/25"},{"t":"Between Peasants","a":"Errico Malatesta","r":5,"i":"0981289770","g":"34474724","c":"1677831733l/34474724._SY475_.jpg","n":64,"w":"8288159632","d":"2026/09/25"},{"t":"The White Tiger","a":"Aravind Adiga","r":5,"v":1,"i":"1416562591","g":"1768603","c":"1710937569l/1768603._SY475_.jpg","n":288,"w":"8952379673","d":"2026/09/24"},{"t":"The Frugal Wizard's Handbook for Surviving Medieval England (Secret Projects, #2)","a":"Brandon Sanderson","r":2,"v":1,"i":"9781938570339","g":"60531410","c":"1680535465l/60531410.jpg","n":399,"w":"8062064672","d":"2026/09/18"},{"t":"The Infinite Extent (Bobiverse, #6)","a":"Dennis E. Taylor","r":5,"v":1,"g":"255460483","c":"1784111102l/255460483._SX318_.jpg","n":8,"w":"8938536115","d":"2026/09/14"},{"t":"The Pilot (The Last Horizon #4)","a":"Will Wight","r":5,"g":"235156795","c":"1748353785l/235156795._SY475_.jpg","n":421,"w":"8772350080","d":"2026/09/11"},{"t":"The Knight (The Last Horizon, #3)","a":"Will Wight","r":5,"g":"213353605","c":"1715707898l/213353605._SY475_.jpg","n":407,"w":"8772349976","d":"2026/09/09"},{"t":"Concept of Death","a":"C. Mantis","r":3,"g":"253001898","c":"1780436845l/253001898.jpg","w":"8918564711","d":"2026/09/06"},{"t":"The Path of Ascension 3 (The Path of Ascension #3)","a":"C. Mantis","r":4,"g":"97458422","c":"1676522927l/97458422._SX318_.jpg","n":725,"w":"8894530612","d":"2026/09/04"},{"t":"The Path of Ascension 2 (The Path of Ascension #2)","a":"C. Mantis","r":4,"g":"62836635","c":"1665872641l/62836635.jpg","n":569,"w":"8875976091","d":"2026/08/26"},{"t":"The Path of Ascension (The Path of Ascension #1)","a":"C. Mantis","r":4,"g":"62037390","c":"1661063219l/62037390._SX318_.jpg","n":812,"w":"6568054292","d":"2026/08/20"},{"t":"Parable of the Sower (Earthseed, #1)","a":"Octavia E. Butler","r":5,"i":"9780446675505","g":"52397","c":"1442169447l/52397._SY475_.jpg","n":368,"w":"6582134708","d":"2026/08/10"},{"t":"The Engineer (The Last Horizon, #2)","a":"Will Wight","r":5,"v":1,"g":"201127814","c":"1698761190l/201127814._SY475_.jpg","n":419,"w":"8772349795","d":"2026/08/05"},{"t":"The Left Hand of Darkness","a":"Ursula K. Le Guin","r":5,"v":1,"g":"18423","c":"1488213612l/18423._SY475_.jpg","n":304,"w":"5407045232","d":"2026/08/01"},{"t":"Mage Tank: Book One (Mage Tank, #1)","a":"Cornman","r":3,"g":"219062651","c":"1726172112l/219062651._SY475_.jpg","n":736,"w":"7674665806","d":"2026/07/29"},{"t":"Reborn as a Demonic Tree (Reborn as a Demonic Tree #1)","a":"Xkarnation","r":3,"g":"192553534","c":"1693933813l/192553534._SY475_.jpg","n":618,"w":"6575325203","d":"2026/07/25"},{"t":"The Captain (The Last Horizon, #1)","a":"Will Wight","r":5,"g":"123165953","c":"1677783694l/123165953._SY475_.jpg","n":467,"w":"6250022192","d":"2026/07/16"},{"t":"An Introduction to Greek Philosophy (The Great Courses)","a":"David Roochnik","r":3,"i":"9781565853522","g":"1866024","c":"1424132627l/1866024.jpg","n":12,"w":"8752472433","d":"2026/07/12"},{"t":"Beware of Chicken 2 (Beware of Chicken, #2)","a":"CasualFarmer","r":2,"i":"9781039415713","g":"81360229","c":"1674232458l/81360229._SY475_.jpg","n":685,"w":"8741826322","d":"2026/07/08"},{"t":"Children of Time (Children of Time, #1)","a":"Adrian Tchaikovsky","r":3,"i":"9781447273288","g":"25499718","c":"1431014197l/25499718.jpg","n":600,"w":"5285055944","d":"2026/07/04"},{"t":"Not Till We Are Lost (Bobiverse, #5)","a":"Dennis E. Taylor","r":5,"v":1,"g":"159116833","c":"1712930306l/159116833._SX318_.jpg","n":12,"w":"8595429901","d":"2026/06/27"},{"t":"Beware of Chicken (Beware of Chicken, #1)","a":"CasualFarmer","r":5,"v":1,"i":"9781039413993","g":"60888209","c":"1650996799l/60888209._SY475_.jpg","n":485,"w":"6456710005","d":"2026/06/24"},{"t":"Becoming a Great Essayist (The Great Courses)","a":"Jennifer Cognard-Black","r":5,"i":"9781629972930","g":"40916733","c":"1667259334l/40916733.jpg","n":24,"w":"8676658809","d":"2026/06/19"},{"t":"The Art of Public Speaking: Lessons From the Greatest Speeches in History","a":"John R. Hale","r":4,"v":1,"i":"9781598037012","g":"24551767","c":"1494174917l/24551767.jpg","n":186,"w":"8658839442","d":"2026/06/10"},{"t":"A Parade of Horribles (Dungeon Crawler Carl, #8)","a":"Matt Dinniman","r":5,"v":1,"i":"9798217190065","g":"243312356","c":"1768406644l/243312356._SY475_.jpg","n":704,"w":"8441718179","d":"2026/06/04"},{"t":"Mark of the Fool 10 (Mark of the Fool, #10)","a":"J.M. Clarke","r":5,"g":"222755622","c":"1754652558l/222755622._SY475_.jpg","n":963,"w":"7374714464","d":"2026/05/25"},{"t":"A Brief History of Chronomancy (Arcane Ascension, #6)","a":"Andrew Rowe","r":4,"g":"227839115","c":"1743559046l/227839115._SY475_.jpg","n":449,"w":"7803542036","d":"2026/05/10"},{"t":"Mark of the Fool 9 (Mark of the Fool, #9)","a":"J.M. Clarke","r":5,"g":"218682990","c":"1739289530l/218682990._SY475_.jpg","n":839,"w":"7374714353","d":"2026/04/29"},{"t":"1% Lifesteal, Book Four (1% Lifesteal #4)","a":"Robert Blaise","r":4,"g":"241455809","c":"1765876080l/241455809._SY475_.jpg","n":524,"w":"8533984526","d":"2026/04/22"},{"t":"1% Lifesteal, Book Three (1% Lifesteal #3)","a":"Robert Blaise","r":4,"g":"235374732","c":"1748629219l/235374732._SY475_.jpg","n":722,"w":"8509686962","d":"2026/04/18"},{"t":"1% Lifesteal, Book Two (1% Lifesteal #2)","a":"Robert Blaise","r":3,"g":"228563541","c":"1740993785l/228563541._SY475_.jpg","n":722,"w":"8509685183","d":"2026/04/09"},{"t":"1% Lifesteal, Book One (1% Lifesteal, #1)","a":"Robert Blaise","r":4,"g":"219065671","c":"1726173570l/219065671._SY475_.jpg","n":604,"w":"8480188124","d":"2026/04/03"},{"t":"He Who Fights with Monsters 12 (He Who Fights with Monsters #12)","a":"Shirtaloon","r":5,"g":"228243501","c":"1740156144l/228243501._SY475_.jpg","n":572,"w":"8466789458","d":"2026/03/30"},{"t":"He Who Fights with Monsters 11 (He Who Fights with Monsters, #11)","a":"Shirtaloon","r":5,"v":1,"g":"211179973","c":"1712851422l/211179973._SX318_.jpg","n":766,"w":"6423135295","d":"2026/03/25"},{"t":"He Who Fights with Monsters 10 (He Who Fights with Monsters, #10)","a":"Shirtaloon","r":5,"g":"131499749","c":"1701641280l/131499749._SX318_.jpg","n":758,"w":"5978889701","d":"2026/03/19","p":["2023/12/15"]},{"t":"He Who Fights with Monsters 9 (He Who Fights with Monsters, #9)","a":"Shirtaloon","r":5,"g":"68046804","c":"1671161623l/68046804._SX318_.jpg","n":662,"w":"5978889679","d":"2026/03/15","p":["2023/12/09"]},{"t":"He Who Fights With Monsters 7 (He Who Fights with Monsters, #7)","a":"Shirtaloon","r":5,"g":"61379442","c":"1656715546l/61379442._SX318_.jpg","n":622,"w":"5978889613","d":"2026/03/09","p":["2023/11/21"]},{"t":"He Who Fights with Monsters 6 (He Who Fights with Monsters, #6)","a":"Shirtaloon","r":5,"g":"60725860","c":"1648731697l/60725860._SX318_.jpg","n":564,"w":"5978889594","d":"2026/03/03","p":["2023/11/18"]},{"t":"Eight O'Clock in the Morning","a":"Ray Faraday Nelson","r":3,"v":1,"g":"5841632","c":"1438669504l/5841632.jpg","n":5,"w":"8393553355","d":"2026/02/26"},{"t":"He Who Fights with Monsters 4 (He Who Fights with Monsters, #4)","a":"Shirtaloon","r":5,"g":"58821848","c":"1629551546l/58821848._SX318_.jpg","n":828,"w":"5958564543","d":"2026/02/14","p":["2023/11/11"]},{"t":"He Who Fights with Monsters 3 (He Who Fights with Monsters, #3)","a":"Shirtaloon","r":5,"g":"58088499","c":"1621351547l/58088499._SX318_.jpg","n":722,"w":"5946772703","d":"2026/02/08","p":["2023/11/06"]},{"t":"He Who Fights with Monsters 2 (He Who Fights with Monsters, #2)","a":"Shirtaloon","r":5,"v":1,"g":"57456018","c":"1616122903l/57456018._SX318_.jpg","n":564,"w":"5929346069","d":"2026/02/01","p":["2023/10/31"]},{"t":"He Who Fights with Monsters (He Who Fights with Monsters, #1)","a":"Shirtaloon","r":5,"v":1,"g":"57189884","c":"1614114118l/57189884._SX318_.jpg","n":680,"w":"4952737076","d":"2026/01/23","p":["2023/10/22"]},{"t":"The Dichotomy of Leadership: Balancing the Challenges of Extreme Ownership to Lead and Win","a":"Jocko Willink","r":5,"i":"9781250195784","g":"38714388","c":"1523163610l/38714388._SY475_.jpg","n":320,"w":"8243876492","d":"2026/01/14"},{"t":"Grave Peril (The Dresden Files, #3)","a":"Jim Butcher","r":3,"g":"91476","c":"1266470209l/91476.jpg","n":378,"w":"2537769789","d":"2026/01/09","p":["2018/01/01"]},{"t":"Summer Knight (The Dresden Files, #4)","a":"Jim Butcher","r":1,"v":1,"i":"9780451458926","g":"91478","c":"1661018511l/91478._SY475_.jpg","n":446,"w":"2537769834","d":"2026/01/09","p":["2018/01/01"]},{"t":"Fool Moon (The Dresden Files, #2)","a":"Jim Butcher","r":2,"i":"9780451458124","g":"91477","c":"1661018595l/91477._SY475_.jpg","n":432,"w":"2537769753","d":"2026/01/06","p":["2018/01/01"]},{"t":"The First 90 Days: Proven Strategies for Getting Up to Speed Faster and Smarter","a":"Michael D. Watkins","r":3,"i":"9781422188613","g":"15824358","c":"1354903827l/15824358.jpg","n":304,"w":"8186648110","d":"2026/01/05"},{"t":"Storm Front (The Dresden Files, #1)","a":"Jim Butcher","r":2,"v":1,"i":"9780451457813","g":"47212","c":"1572991273l/47212._SY475_.jpg","n":355,"w":"2537769662","d":"2026/01/03","p":["2018/01/01"]},{"t":"This Inevitable Ruin (Dungeon Crawler Carl, #7)","a":"Matt Dinniman","r":5,"g":"216017751","c":"1721753342l/216017751._SY475_.jpg","n":870,"w":"7374719010","d":"2025/12/31","p":["2025/03/19"]},{"t":"The Magic Shop: (H G Wells Masterpiece Collection)","a":"H.G. Wells","r":2,"i":"9781497326361","g":"21487136","c":"1677810036l/21487136._SY475_.jpg","n":26,"w":"8194491684","d":"2025/12/30"},{"t":"The Butcher's Masquerade (Dungeon Crawler Carl, #5)","a":"Matt Dinniman","r":5,"v":1,"g":"60233239","c":"1734202962l/60233239._SY475_.jpg","n":768,"w":"5878185207","d":"2025/12/06","p":["2023/10/06"]},{"t":"The Gate of the Feral Gods (Dungeon Crawler Carl, #4)"